[
  {
    "name": "Abu Dhabi",
    "summary": "Operating as the Abu Dhabi Global Market (ADGM), this jurisdiction uses the direct application of English common law and provides a flexible, risk-based captive framework. It offers a dedicated rulebook and a streamlined application process with four distinct classes of captive insurers to meet varied business needs. A major benefit is the 0% tax environment guaranteed until 2065, along with the ability to outsource all management functions to ADGM-authorized managers.",
    "jurisdiction": "Offshore (UAE)",
    "legislation": "ADGM Captive Insurance Rulebook",
    "min_capital": {
      "Class 1 (Pure)": "$150,000",
      "Class 2": "$250,000",
      "Class 3 (Group/Association)": "$500,000",
      "Class 4": "$1,000,000"
    },
    "tax_notes": "0% tax until 2065; 5% VAT may apply",
    "slug": "abu-dhabi",
    "contact_name": null,
    "contact_email": null,
    "last_verified": null,
    "source_urls": [],
    "legislation_year": null,
    "licensing_speed": null,
    "regulator_staff_count": null,
    "annual_filing_requirements": null,
    "types_allowed": [],
    "stats": null,
    "fees": null,
    "regulator": null,
    "captive_administrator": null
  },
  {
    "name": "Alabama",
    "summary": "Alabama positions itself at the forefront of the industry by offering innovative features like a 60-day provisional license and the ability to form as any entity allowed under law, including Series LLCs. Legislation enacted in 2006 was significantly updated in 2016 to modernize the Alabama Captive Act and enhance competitiveness. The state is active in advocacy through the Alabama Captive Insurance Association and offers prorated premium taxes in the first year.",
    "jurisdiction": "Onshore (USA)",
    "legislation": "Alabama Captive Act (HB 270 update in 2016)",
    "min_capital": {
      "Pure / Protected Cell": "$250,000",
      "RRG / Industrial Insured": "$500,000",
      "Reciprocals": "$1,000,000"
    },
    "tax_notes": "$100,000 maximum cap; no tax on dormant captives",
    "slug": "alabama",
    "contact_name": null,
    "contact_email": null,
    "last_verified": null,
    "source_urls": []
  },
  {
    "name": "Alberta",
    "summary": "Alberta does not have dedicated captive insurance legislation, but captives can be established under the province's general Insurance Act with approval from the Alberta Superintendent of Insurance. The province's strong energy and natural resource sectors create significant demand for alternative risk transfer mechanisms. Alberta offers a business-friendly regulatory environment and competitive corporate tax rates, making it an emerging consideration for Canadian enterprises exploring captive solutions.",
    "jurisdiction": "Onshore (Canada)",
    "legislation": "Alberta Insurance Act (General Provisions)",
    "min_capital": {
      "Single parent captives": "Capital Guideline for Captive Insurance Companies – November 2025"
    },
    "tax_notes": "Provincial premium taxes apply; competitive corporate tax rate of 8%",
    "contact_name": "Alberta Superintendent of Insurance",
    "contact_email": "tbf.insurance-licens@gov.ab.ca",
    "last_verified": "2026-06-29",
    "source_urls": [
      "https://www.alberta.ca/information-for-captive-insurers"
    ],
    "slug": "alberta",
    "legislation_year": 2022,
    "stats": {
      "reporting_year": 2025,
      "total_captives": 37,
      "new_captives": 6,
      "surrendered_licenses": 0,
      "pure_captives": 37,
      "group_captives": 0,
      "sponsored_cell_captives": 0,
      "individual_cells_count": 0,
      "other_captives": 0
    },
    "types_allowed": [
      "Single parent captives"
    ],
    "regulator_staff_count": null,
    "fees": null,
    "annual_filing_requirements": null,
    "applicable_legislation": "Alberta Insurance Act",
    "captive_administrator": {
      "name": "Alberta Superintendent of Insurance",
      "email": "tbf.insurance-licens@gov.ab.ca",
      "phone": "780-643-2237",
      "fax": "780-420-0752"
    },
    "licensing_speed": null,
    "regulator": {
      "name": "Alberta Treasury Board and Finance",
      "address": "Alberta Superintendent of Insurance, Alberta Treasury Board and Finance, Financial Sector Regulation and Policy, 402 Terrace Building, 9515 107 Street, Edmonton, Alberta T5K 2C3",
      "website": "https://www.alberta.ca/information-for-captive-insurers"
    }
  },
  {
    "name": "Anguilla",
    "summary": "Anguilla's Insurance Act provides a comprehensive framework for domestic, offshore, and captive insurance, notably including a specific 2018 provision for producer-affiliated reinsurance companies. The domicile offers five sub-categories of Class B licenses, ranging from unrestricted foreign business to single-owner captives. Unless maintaining a permanent local staff, insurers are required to appoint a licensed insurance manager.",
    "jurisdiction": "Offshore",
    "legislation": "Anguilla Insurance Act",
    "min_capital": {
      "Property and Casualty": "$100,000",
      "Life and Health": "$200,000"
    },
    "tax_notes": "Tax-neutral structures for Class B insurers",
    "slug": "anguilla",
    "contact_name": null,
    "contact_email": null,
    "last_verified": null,
    "source_urls": []
  },
  {
    "name": "Arizona",
    "summary": "Established in 2002, Arizona is a mature and proven domicile supported by a stable regulatory team and a well-established network of local service providers. The state is highly competitive due to the absence of insurance premium taxes and state/local income taxes for most licensed captives. It provides an electronic filing portal and a cost-effective application process, licensing varied structures including agency and branch captives.",
    "jurisdiction": "Onshore (USA)",
    "legislation": "Arizona Revised Statutes",
    "min_capital": {
      "Pure": "$250,000",
      "Association / Agency / Cell": "$500,000",
      "RRG": "$500,000"
    },
    "tax_notes": "No premium or state income taxes; flat annual license fee",
    "slug": "arizona",
    "contact_name": null,
    "contact_email": null,
    "last_verified": null,
    "source_urls": []
  },
  {
    "name": "Arkansas",
    "summary": "Arkansas aggressively recruits captives by refining its laws, including major changes in 2017 and 2019 that reduced capital requirements and welcomed RRGs. It is recognized as one of the most cost-effective domiciles, featuring low application and license fees and a $100,000 tax liability cap. The Arkansas Insurance Department offers no-cost preliminary analyses for companies considering captive formation.",
    "jurisdiction": "Onshore (USA)",
    "legislation": "Arkansas Captive Laws (refined 2017-2019)",
    "min_capital": {
      "Industrial Insured": "$200k Cap / $300k Surplus",
      "Sponsored": "$250k Cap / $250k Surplus",
      "Producer Reinsurance": "$300k Cap / $300k Surplus",
      "Association": "$400k Cap / $350k Surplus"
    },
    "tax_notes": "$100,000 maximum annual tax liability",
    "slug": "arkansas",
    "contact_name": null,
    "contact_email": null,
    "last_verified": null,
    "source_urls": []
  },
  {
    "name": "Aruba",
    "summary": "Aruba offers a safe and stable environment for financial services with an international legal framework overseen by the Central Bank of Aruba. Captives are defined as businesses insuring risks originating almost exclusively from shareholders, affiliates, or joint venture participants. Operations must maintain an office in Aruba for financial administration and have at least one managing director residing on the island.",
    "jurisdiction": "Offshore (Caribbean)",
    "legislation": "Central Bank of Aruba regulations",
    "min_capital": {
      "General": "Subject to Central Bank review and actuarial report"
    },
    "tax_notes": "Requires annual audited financial statements",
    "slug": "aruba",
    "contact_name": null,
    "contact_email": null,
    "last_verified": null,
    "source_urls": []
  },
  {
    "name": "Bahrain",
    "summary": "Bahrain serves as a regional base for international insurers, with a sector regulated by the Central Bank of Bahrain (CBB) as a single regulator since 2002. The CBB differentiates between captive and commercial insurers, offering lower capital and solvency requirements for captives provided they do not include third-party liability risks. The domicile is supported by a large pool of brokers, actuaries, and insurance managers.",
    "jurisdiction": "Offshore",
    "legislation": "CBB Regulatory Framework",
    "min_capital": {
      "Captive": "Risk-based; lower than traditional insurers unless third-party liability is involved"
    },
    "tax_notes": "Competitive regulatory environment",
    "slug": "bahrain",
    "contact_name": null,
    "contact_email": null,
    "last_verified": null,
    "source_urls": []
  },
  {
    "name": "Barbados",
    "summary": "Barbados is a top-tier domicile known for its political stability and extensive bilateral double taxation treaty network with countries like Canada and the US. In 2019, it eliminated its ring-fenced regime, replacing the Exempt Insurance Act with a unified Insurance Act classified into three distinct license classes. Class 1 captives are restricted to related party business, while Class 2 can underwrite third-party risks with a 2% tax rate.",
    "jurisdiction": "Offshore",
    "legislation": "Insurance Act, Cap. 310 (effective 2019)",
    "min_capital": {
      "Insurance Companies": "$125,000"
    },
    "tax_notes": "0% for Class 1; 2% for Class 2 and Class 3 entities",
    "slug": "barbados",
    "contact_name": null,
    "contact_email": null,
    "last_verified": null,
    "source_urls": []
  },
  {
    "name": "Bermuda",